{
  "$schema": "https://json-schema.org/draft/2020-12/schema",
  "$id": "https://example.invalid/contracts/pricing-year-validation/pricing-year-validation.schema.json",
  "title": "Funding calculator pricing-year validation contract",
  "type": "object",
  "additionalProperties": false,
  "required": [
    "schema_version",
    "validation_id",
    "tool",
    "privacy",
    "commands",
    "validation_rules",
    "outputs",
    "provenance",
    "examples"
  ],
  "properties": {
    "schema_version": {
      "type": "string",
      "const": "1.0"
    },
    "validation_id": {
      "type": "string",
      "pattern": "^[a-z0-9_\\-]+$"
    },
    "tool": {
      "type": "object",
      "additionalProperties": false,
      "required": [
        "name",
        "package",
        "entry_point"
      ],
      "properties": {
        "name": {
          "type": "string"
        },
        "package": {
          "type": "string"
        },
        "entry_point": {
          "type": "string"
        }
      }
    },
    "privacy": {
      "type": "object",
      "additionalProperties": false,
      "required": [
        "classification",
        "contains_phi",
        "notes"
      ],
      "properties": {
        "classification": {
          "type": "string",
          "enum": [
            "synthetic"
          ]
        },
        "contains_phi": {
          "type": "boolean",
          "const": false
        },
        "notes": {
          "type": "string"
        }
      }
    },
    "commands": {
      "type": "array",
      "minItems": 1,
      "items": {
        "type": "object",
        "additionalProperties": false,
        "required": [
          "name",
          "syntax",
          "status",
          "inputs",
          "outputs"
        ],
        "properties": {
          "name": {
            "type": "string",
            "const": "validate-year"
          },
          "syntax": {
            "type": "string",
            "const": "funding-calculator validate-year <year>"
          },
          "status": {
            "type": "string",
            "enum": [
              "preview",
              "stable"
            ]
          },
          "inputs": {
            "type": "array",
            "minItems": 1,
            "items": {
              "type": "string"
            }
          },
          "outputs": {
            "type": "array",
            "minItems": 1,
            "items": {
              "type": "string"
            }
          },
          "notes": {
            "type": "string"
          }
        }
      }
    },
    "validation_rules": {
      "type": "array",
      "minItems": 1,
      "items": {
        "type": "object",
        "additionalProperties": false,
        "required": [
          "id",
          "label",
          "severity",
          "description"
        ],
        "properties": {
          "id": {
            "type": "string",
            "pattern": "^[a-z0-9_\\-]+$"
          },
          "label": {
            "type": "string"
          },
          "severity": {
            "type": "string",
            "enum": [
              "info",
              "warning",
              "error"
            ]
          },
          "description": {
            "type": "string"
          }
        }
      }
    },
    "outputs": {
      "type": "object",
      "additionalProperties": false,
      "required": [
        "report_format",
        "pass_state",
        "fail_state",
        "diagnostic_format"
      ],
      "properties": {
        "report_format": {
          "type": "string",
          "enum": [
            "json"
          ]
        },
        "pass_state": {
          "type": "string",
          "const": "pass"
        },
        "fail_state": {
          "type": "string",
          "const": "fail"
        },
        "diagnostic_format": {
          "type": "string",
          "enum": [
            "json"
          ]
        }
      }
    },
    "provenance": {
      "type": "object",
      "additionalProperties": false,
      "required": [
        "fields",
        "checksum_algorithm"
      ],
      "properties": {
        "fields": {
          "type": "array",
          "minItems": 1,
          "items": {
            "type": "string"
          }
        },
        "checksum_algorithm": {
          "type": "string",
          "enum": [
            "sha256"
          ]
        }
      }
    },
    "examples": {
      "type": "array",
      "minItems": 1,
      "items": {
        "type": "object",
        "additionalProperties": false,
        "required": [
          "name",
          "path",
          "description"
        ],
        "properties": {
          "name": {
            "type": "string"
          },
          "path": {
            "type": "string"
          },
          "description": {
            "type": "string"
          }
        }
      }
    }
  }
}
